{
  "template_id": "TN-NDA-001",
  "slug": "unilateral-nda",
  "name": "Unilateral Non-Disclosure Agreement",
  "library": "ClauseCite Tamil Nadu NDA Template Library",
  "version": "1.0.0",
  "jurisdiction": {
    "country": "India",
    "state": "Tamil Nadu",
    "state_is_default_not_exclusive": true
  },
  "agreement_type": "unilateral",
  "summary": "One party discloses confidential information to one receiving party for a defined purpose.",
  "party_roles": [
    "Disclosing Party",
    "Receiving Party"
  ],
  "purpose_default": "evaluate the proposed business relationship or transaction described in Schedule 1",
  "fields": [
    {
      "key": "effective_date",
      "label": "Effective date",
      "type": "date",
      "required": true
    },
    {
      "key": "disclosing_party_legal_name",
      "label": "Disclosing party legal name",
      "type": "string",
      "required": true
    },
    {
      "key": "disclosing_party_entity_type",
      "label": "Entity type / constitution",
      "type": "string",
      "required": false
    },
    {
      "key": "disclosing_party_registered_address",
      "label": "Registered / principal address",
      "type": "address",
      "required": true
    },
    {
      "key": "receiving_party_legal_name",
      "label": "Receiving party legal name",
      "type": "string",
      "required": true
    },
    {
      "key": "receiving_party_entity_type",
      "label": "Entity type / constitution",
      "type": "string",
      "required": false
    },
    {
      "key": "receiving_party_address",
      "label": "Registered / residential address",
      "type": "address",
      "required": true
    },
    {
      "key": "purpose",
      "label": "Defined Purpose",
      "type": "textarea",
      "required": true
    },
    {
      "key": "confidentiality_period_years",
      "label": "Confidentiality period (years)",
      "type": "integer",
      "required": true
    },
    {
      "key": "trade_secret_survival",
      "label": "Trade secret protection survival",
      "type": "enum",
      "options": [
        "while information remains a trade secret under applicable law",
        "fixed period selected by parties"
      ],
      "required": true
    },
    {
      "key": "notice_email_discloser",
      "label": "Discloser notice email",
      "type": "email",
      "required": true
    },
    {
      "key": "notice_email_receiver",
      "label": "Receiver notice email",
      "type": "email",
      "required": true
    },
    {
      "key": "governing_state",
      "label": "Governing law jurisdiction",
      "type": "enum",
      "options": [
        "India; Tamil Nadu-specific mandatory law applies where relevant"
      ],
      "required": true
    },
    {
      "key": "court_city",
      "label": "Courts having jurisdiction (subject to law)",
      "type": "string",
      "required": false
    },
    {
      "key": "arbitration_option",
      "label": "Dispute resolution option",
      "type": "enum",
      "options": [
        "courts",
        "arbitration"
      ],
      "required": true
    },
    {
      "key": "arbitration_seat",
      "label": "Arbitration seat (if selected)",
      "type": "string",
      "required": false
    },
    {
      "key": "arbitrator_count",
      "label": "Number of arbitrators",
      "type": "enum",
      "options": [
        "one",
        "three"
      ],
      "required": false
    },
    {
      "key": "language",
      "label": "Agreement language",
      "type": "enum",
      "options": [
        "English",
        "Tamil",
        "Bilingual English-Tamil"
      ],
      "required": true
    },
    {
      "key": "agreement_term",
      "label": "Agreement term",
      "type": "string",
      "required": true,
      "default": "2 years"
    },
    {
      "key": "termination_notice_days",
      "label": "Termination notice days",
      "type": "integer",
      "required": true,
      "default": 30
    },
    {
      "key": "cure_period_days",
      "label": "Breach cure period days",
      "type": "integer",
      "required": true,
      "default": 15
    },
    {
      "key": "return_delete_days",
      "label": "Return/deletion period days",
      "type": "integer",
      "required": true,
      "default": 15
    },
    {
      "key": "negotiation_days",
      "label": "Senior negotiation period days",
      "type": "integer",
      "required": true,
      "default": 30
    },
    {
      "key": "dispute_mechanism",
      "label": "Dispute mechanism",
      "type": "string",
      "required": true,
      "default": "courts / arbitration as selected in Schedule 4"
    }
  ],
  "clauses": [
    {
      "clause_id": "definitions",
      "title": "Confidential Information — definition",
      "type": "standard",
      "required": true,
      "enabled_by_default": true,
      "advocate_review_required": true,
      "text": "“Confidential Information” means information disclosed or made available, directly or indirectly, by or on behalf of a Disclosing Party to a Receiving Party, its Representatives or permitted recipients, whether before, on or after the Effective Date and whether in oral, visual, written, electronic, machine-readable, sample, demonstration or other form, that is marked confidential or that reasonably should be understood to be confidential from its nature or the circumstances of disclosure. It includes the categories and examples listed in Schedule 1, together with copies, extracts, notes, analyses, compilations and materials derived from it, to the extent they contain or reflect such information. The parties may identify particularly sensitive items in Schedule 1."
    },
    {
      "clause_id": "purpose",
      "title": "Permitted Purpose and use limitation",
      "type": "standard",
      "required": true,
      "enabled_by_default": true,
      "advocate_review_required": true,
      "text": "The Receiving Party shall use Confidential Information solely to evaluate, negotiate, perform or administer the following expressly defined purpose: {{purpose}} (“Purpose”). It shall not use Confidential Information for any competing, commercial, personal, research, benchmarking, reverse-engineering, model-training or other purpose unless that use is expressly authorised in writing by the Disclosing Party and is lawful. No licence or other right is granted except the limited right to use the information for the Purpose."
    },
    {
      "clause_id": "exclusions",
      "title": "Exclusions from Confidential Information",
      "type": "standard",
      "required": true,
      "enabled_by_default": true,
      "advocate_review_required": true,
      "text": "Confidential Information does not include information that the Receiving Party can demonstrate through contemporaneous written records: (a) is or becomes publicly available other than through breach of this Agreement or a duty owed to the Disclosing Party; (b) was lawfully known to it without restriction before disclosure; (c) is received lawfully from a third party without breach of a confidentiality obligation; or (d) is independently developed without use of or reference to Confidential Information. A combination of information is not excluded merely because individual elements are public or known; the combination itself must qualify for an exclusion. The burden of establishing an exclusion rests on the party relying on it."
    },
    {
      "clause_id": "obligations",
      "title": "Core confidentiality and security obligations",
      "type": "standard",
      "required": true,
      "enabled_by_default": true,
      "advocate_review_required": true,
      "text": "The Receiving Party shall: (a) protect Confidential Information using at least the same degree of care it uses for its own similar sensitive information and, in all cases, no less than reasonable care; (b) prevent unauthorised access, use, copying, alteration, loss or disclosure; (c) restrict access on a need-to-know basis to permitted Representatives bound by written or professional duties no less protective than this Agreement; (d) remain responsible for acts and omissions of its Representatives; (e) maintain appropriate administrative, technical and physical safeguards; (f) promptly notify the Disclosing Party of any actual or reasonably suspected unauthorised access, use, loss or disclosure; and (g) reasonably cooperate to contain, investigate and remediate the incident."
    },
    {
      "clause_id": "exceptions",
      "title": "Legally compelled disclosure",
      "type": "standard",
      "required": true,
      "enabled_by_default": true,
      "advocate_review_required": true,
      "text": "If the Receiving Party or a Representative is required by applicable law, court order, regulator or competent governmental authority to disclose Confidential Information, it may disclose only the portion legally required, provided that (to the extent legally permitted) it gives prompt prior written notice, reasonably cooperates with efforts to seek confidential treatment or protective relief, and discloses only after taking reasonable steps to preserve confidentiality. No notice is required where prohibited by law or a binding direction."
    },
    {
      "clause_id": "disclosure",
      "title": "Permitted disclosure to Representatives",
      "type": "standard",
      "required": true,
      "enabled_by_default": true,
      "advocate_review_required": true,